{
  "schemaVersion": "1.0",
  "verifiedAt": "2026-09-06",
  "note": "구글맵 이름 검색어. 좌표가 아니라 이름으로 여는 것이 정확한 대상만 싣는다. 여기 없으면 좌표·주소로 폴백한다.",
  "places": {
    "arc-de-triomphe": {
      "query": "Arc de Triomphe, Place Charles de Gaulle, Paris",
      "verdict": "FOUND",
      "resolvedName": "Arc de Triomphe",
      "evidence": "https://www.paris-arc-de-triomphe.fr/",
      "verifiedAt": "2026-09-07"
    },
    "abbaye-de-senanque": {
      "query": "Abbaye Notre-Dame de Sénanque, Gordes",
      "verdict": "FOUND",
      "resolvedName": "Abbaye Notre-Dame de Sénanque",
      "evidence": "https://www.senanque.fr/",
      "verifiedAt": "2026-08-22"
    },
    "annecy": {
      "query": "Palais de l'Île, Annecy",
      "verdict": "AMBIGUOUS",
      "resolvedName": "Annecy Vieille Ville",
      "evidence": "https://en.wikipedia.org/wiki/Annecy",
      "verifiedAt": "2026-08-22",
      "anchorFor": "Annecy 구시가지"
    },
    "arenes-d-arles": {
      "query": "Arènes d'Arles, Arles",
      "verdict": "FOUND",
      "resolvedName": "Amphithéâtre romain d'Arles",
      "evidence": "https://www.arlestourisme.com/en/arenas-amphitheatre.html",
      "verifiedAt": "2026-08-22"
    },
    "arenes-de-nimes": {
      "query": "Arènes de Nîmes, Boulevard des Arènes, Nîmes",
      "verdict": "FOUND",
      "resolvedName": "Arènes de Nîmes",
      "evidence": "https://www.arenes-nimes.com/",
      "verifiedAt": "2026-08-23"
    },
    "arles": {
      "query": "Arles, France",
      "verdict": "FOUND",
      "resolvedName": "Arles",
      "evidence": "https://en.wikipedia.org/wiki/Arles",
      "verifiedAt": "2026-08-22"
    },
    "atelier-des-lauves": {
      "query": "Atelier de Cézanne, Aix-en-Provence",
      "verdict": "FOUND",
      "resolvedName": "Atelier de Cézanne",
      "evidence": "https://www.atelier-cezanne.com/",
      "verifiedAt": "2026-08-22"
    },
    "bar-canete": {
      "query": "Bar Cañete, Carrer de la Unió 17, Barcelona",
      "verdict": "FOUND",
      "resolvedName": "Bar Cañete",
      "evidence": "https://www.oadguides.com/restaurant/bar-canete",
      "verifiedAt": "2026-08-22"
    },
    "barcelona-sants": {
      "query": "Hertz, C/ Viriat 45, Barcelona",
      "verdict": "FOUND",
      "resolvedName": "Hertz Barcelona Sants",
      "evidence": "https://www.hertz.es/rentacar/location/spain/barcelona/BCNX01",
      "verifiedAt": "2026-08-24"
    },
    "barri-gotic": {
      "query": "Barri Gòtic, Barcelona",
      "verdict": "FOUND",
      "resolvedName": "Barri Gòtic",
      "evidence": "https://www.barcelonaturisme.com/",
      "verifiedAt": "2026-08-22"
    },
    "bastide-du-jas-de-bouffan": {
      "query": "Bastide du Jas de Bouffan, Aix-en-Provence",
      "verdict": "FOUND",
      "resolvedName": "La Bastide du Jas de Bouffan",
      "evidence": "https://www.cezanne-en-provence.com/les-sites-de-cezanne/bastide-du-jas-de-bouffan/",
      "verifiedAt": "2026-08-22"
    },
    "bellecour": {
      "query": "Place Bellecour, Lyon",
      "verdict": "FOUND",
      "resolvedName": "Place Bellecour",
      "evidence": "https://en.wikipedia.org/wiki/Place_Bellecour",
      "verifiedAt": "2026-08-22"
    },
    "biblioteca-de-catalunya": {
      "query": "Biblioteca de Catalunya, Carrer de l'Hospital 56, Barcelona",
      "verdict": "FOUND",
      "resolvedName": "Biblioteca de Catalunya",
      "evidence": "https://www.bnc.cat/eng",
      "verifiedAt": "2026-08-22"
    },
    "bnf-richelieu": {
      "query": "BnF Richelieu, Paris",
      "verdict": "FOUND",
      "resolvedName": "BnF – Site Richelieu",
      "evidence": "https://www.bnf.fr/en/the-bnfs-richelieu-site",
      "verifiedAt": "2026-08-22"
    },
    "bodega-joan": {
      "query": "Bodega Joan, Carrer del Rosselló 164, Barcelona",
      "verdict": "AMBIGUOUS",
      "resolvedName": "Bodega Joan",
      "evidence": "https://www.bodegajoan.com/en",
      "verifiedAt": "2026-08-22",
      "anchorFor": "Bodega Joan"
    },
    "bonnieux": {
      "query": "Bonnieux, France",
      "verdict": "FOUND",
      "resolvedName": "Bonnieux",
      "evidence": "https://fr.wikipedia.org/wiki/Bonnieux",
      "verifiedAt": "2026-08-22"
    },
    "bouillon-chartier-montparnasse": {
      "query": "Bouillon Chartier Montparnasse, Paris",
      "verdict": "FOUND",
      "resolvedName": "Bouillon Chartier Montparnasse",
      "evidence": "https://www.bouillon-chartier.com/en/bouillon-chartier-montparnasse-en/",
      "verifiedAt": "2026-08-22"
    },
    "boulangerie-pichard": {
      "query": "Boulangerie Pichard, 88 rue Cambronne, Paris",
      "verdict": "FOUND",
      "resolvedName": "Boulangerie Pichard",
      "evidence": "https://parisbymouth.com/boulangerie-pichard/",
      "verifiedAt": "2026-08-22"
    },
    "bourse-de-commerce-pinault-collection": {
      "query": "Bourse de Commerce — Pinault Collection, Paris",
      "verdict": "FOUND",
      "resolvedName": "Bourse de Commerce — Pinault Collection",
      "evidence": "https://www.pinaultcollection.com/en/boursedecommerce/practical-info",
      "verifiedAt": "2026-08-22"
    },
    "cafe-comptoir-abel": {
      "query": "Café Comptoir Abel, 25 rue Guynemer, Lyon",
      "verdict": "FOUND",
      "resolvedName": "Café Comptoir Abel",
      "evidence": "https://www.visiterlyon.com/",
      "verifiedAt": "2026-08-22"
    },
    "cafe-du-commerce": {
      "query": "Le Café du Commerce, 51 rue du Commerce, Paris",
      "verdict": "FOUND",
      "resolvedName": "Le Café du Commerce",
      "evidence": "https://www.lecafeducommerce.com/infos-pratiques/",
      "verifiedAt": "2026-08-22"
    },
    "calanques": {
      "query": "Calanque de Port-Miou, Cassis",
      "verdict": "AMBIGUOUS",
      "resolvedName": "Parc national des Calanques",
      "evidence": "https://www.calanques-parcnational.fr/",
      "verifiedAt": "2026-08-22",
      "anchorFor": "Calanques"
    },
    "calella-de-palafrugell": {
      "query": "Calella de Palafrugell, Girona",
      "verdict": "FOUND",
      "resolvedName": "Calella de Palafrugell",
      "evidence": "https://costabrava.org/",
      "verifiedAt": "2026-08-22"
    },
    "cannes": {
      "query": "Cannes, France",
      "verdict": "FOUND",
      "resolvedName": "Cannes",
      "evidence": "https://en.cannes-france.com/",
      "verifiedAt": "2026-08-22"
    },
    "carrieres-de-bibemus": {
      "query": "Carrières de Bibémus, Aix-en-Provence",
      "verdict": "FOUND",
      "resolvedName": "Carrières de Bibémus",
      "evidence": "https://www.cezanne-en-provence.com/les-sites-de-cezanne/carrieres-de-bibemus/",
      "verifiedAt": "2026-08-22"
    },
    "carrieres-des-lumieres": {
      "query": "Carrières des Lumières, Les Baux-de-Provence",
      "verdict": "FOUND",
      "resolvedName": "Carrières des Lumières",
      "evidence": "https://www.carrieres-lumieres.com/en/information-access",
      "verifiedAt": "2026-08-22"
    },
    "casa-marieta": {
      "query": "Casa Marieta 1892, Plaça de la Independència 5-6, Girona",
      "verdict": "FOUND",
      "resolvedName": "Restaurant Casa Marieta 1892",
      "evidence": "https://casamarieta.com/en/",
      "verifiedAt": "2026-08-22"
    },
    "cassis": {
      "query": "Port de Cassis, Cassis",
      "verdict": "FOUND",
      "resolvedName": "Port de Cassis",
      "evidence": "https://www.ot-cassis.com/",
      "verifiedAt": "2026-08-22"
    },
    "cau-ferrat": {
      "query": "Museu del Cau Ferrat, Sitges",
      "verdict": "FOUND",
      "resolvedName": "Museu del Cau Ferrat",
      "evidence": "https://museusdesitges.cat/",
      "verifiedAt": "2026-08-22"
    },
    "centre-pompidou": {
      "query": "Centre Pompidou, Paris",
      "verdict": "FOUND",
      "resolvedName": "Centre Pompidou",
      "evidence": "https://www.centrepompidou.fr/en/centre-pompidou-is-transforming-itself",
      "verifiedAt": "2026-08-22"
    },
    "chez-gilbert-cassis": {
      "query": "Chez Gilbert, Cassis",
      "verdict": "FOUND",
      "resolvedName": "Restaurant Chez Gilbert",
      "evidence": "https://www.chezgilbert.net/",
      "verifiedAt": "2026-08-22"
    },
    "chez-mamie-lise": {
      "query": "Chez Mamie Lise, 11 rue Grenette, Annecy",
      "verdict": "FOUND",
      "resolvedName": "Chez Mamie Lise",
      "evidence": "https://www.mamie-lise.com/restaurant-annecy/contact/",
      "verifiedAt": "2026-08-22"
    },
    "cloitre-saint-trophime": {
      "query": "Cloître Saint-Trophime, Arles",
      "verdict": "FOUND",
      "resolvedName": "Cloître Saint-Trophime",
      "evidence": "https://www.arlestourisme.com/en/saint-trophime-cloister.html",
      "verifiedAt": "2026-08-22"
    },
    "colline-du-chateau": {
      "query": "Parc de la Colline du Château, Nice",
      "verdict": "FOUND",
      "resolvedName": "Parc de la Colline du Château",
      "evidence": "https://www.explorenicecotedazur.com/",
      "verifiedAt": "2026-08-22"
    },
    "collioure": {
      "query": "Collioure, France",
      "verdict": "FOUND",
      "resolvedName": "Collioure",
      "evidence": "https://en.wikipedia.org/wiki/Collioure",
      "verifiedAt": "2026-08-22"
    },
    "cours-mirabeau": {
      "query": "Cours Mirabeau, Aix-en-Provence",
      "verdict": "FOUND",
      "resolvedName": "Cours Mirabeau",
      "evidence": "https://www.aix.fr/incontournables/cours-mirabeau",
      "verifiedAt": "2026-08-22"
    },
    "cours-saleya": {
      "query": "Cours Saleya, Nice",
      "verdict": "FOUND",
      "resolvedName": "Cours Saleya (Marché aux fleurs)",
      "evidence": "https://www.explorenicecotedazur.com/",
      "verifiedAt": "2026-08-22"
    },
    "coustellet": {
      "query": "Marché paysan de Coustellet, Maubec",
      "verdict": "FOUND",
      "resolvedName": "Marché paysan de Coustellet",
      "evidence": "https://www.destinationluberon.com/",
      "verifiedAt": "2026-08-22"
    },
    "croix-rousse": {
      "query": "Place de la Croix-Rousse, Lyon",
      "verdict": "AMBIGUOUS",